{
  "components": {
    "MoleculeMatrixButton": {
      "childHierarchy": {
        "Root": [
          "L"
        ]
      },
      "childNodes": {
        "L": {
          "id": "L",
          "kind": "text",
          "props": {
            "color": "semantic:atoms.color.sem.fromRgba",
            "content": "param:label",
            "fontSize": 16,
            "fontWeight": 600
          }
        }
      },
      "expose": [
        "label",
        "kind",
        "size"
      ],
      "name": "MoleculeMatrixButton",
      "params": [
        {
          "default": "Submit",
          "name": "label",
          "type": "String"
        },
        {
          "default": "primary",
          "name": "kind",
          "type": "variant",
          "variantTypeName": "MoleculeMatrixKind"
        },
        {
          "default": "regular",
          "name": "size",
          "type": "variant",
          "variantTypeName": "MoleculeMatrixSize"
        }
      ],
      "root": {
        "kind": "layout",
        "props": {
          "align": "center",
          "background": "primitive:atoms.color.rgb",
          "cornerRadius": "primitive:atoms.radius.md",
          "direction": "row",
          "justify": "center",
          "padding": {
            "bottom": 12,
            "left": 20,
            "right": 20,
            "top": 12
          },
          "wrap": "nowrap"
        }
      },
      "variants": [
        {
          "affectedFrames": [
            "L",
            "Root"
          ],
          "changes": [
            {
              "frameId": "L",
              "prop": "fontSize",
              "value": 12
            },
            {
              "frameId": "Root",
              "prop": "background",
              "value": "primitive:atoms.color.rgba"
            },
            {
              "frameId": "Root",
              "prop": "padding",
              "value": {
                "bottom": 4,
                "left": 8,
                "right": 8,
                "top": 4
              }
            }
          ],
          "params": {
            "kind": "danger",
            "size": "compact"
          }
        },
        {
          "affectedFrames": [
            "Root"
          ],
          "changes": [
            {
              "frameId": "Root",
              "prop": "background",
              "value": "semantic:atoms.color.sem.fromRgb"
            },
            {
              "frameId": "Root",
              "prop": "padding",
              "value": {
                "bottom": 10,
                "left": 16,
                "right": 16,
                "top": 10
              }
            }
          ],
          "params": {
            "kind": "danger",
            "size": "regular"
          }
        },
        {
          "affectedFrames": [
            "L",
            "Root"
          ],
          "changes": [
            {
              "frameId": "L",
              "prop": "fontSize",
              "value": 12
            },
            {
              "frameId": "Root",
              "prop": "background",
              "value": "semantic:atoms.color.sem.fromRgb"
            },
            {
              "frameId": "Root",
              "prop": "padding",
              "value": {
                "bottom": 5,
                "left": 10,
                "right": 10,
                "top": 5
              }
            }
          ],
          "params": {
            "kind": "primary",
            "size": "compact"
          }
        },
        {
          "affectedFrames": [
            "L",
            "Root"
          ],
          "changes": [
            {
              "frameId": "L",
              "prop": "fontSize",
              "value": 12
            },
            {
              "frameId": "Root",
              "prop": "background",
              "value": "semantic:atoms.color.sem.fromRgba"
            },
            {
              "frameId": "Root",
              "prop": "padding",
              "value": {
                "bottom": 4,
                "left": 8,
                "right": 8,
                "top": 4
              }
            }
          ],
          "params": {
            "kind": "secondary",
            "size": "compact"
          }
        },
        {
          "affectedFrames": [
            "Root"
          ],
          "changes": [
            {
              "frameId": "Root",
              "prop": "background",
              "value": "primitive:atoms.color.rgba"
            },
            {
              "frameId": "Root",
              "prop": "padding",
              "value": {
                "bottom": 10,
                "left": 16,
                "right": 16,
                "top": 10
              }
            }
          ],
          "params": {
            "kind": "secondary",
            "size": "regular"
          }
        }
      ]
    }
  },
  "entryPath": "/workspace/test-fixtures/pdl/molecules/m_04_button_variant_matrix.pdl",
  "generatedAt": "2026-08-06T00:33:59.938Z",
  "primaryComponent": "MoleculeMatrixButton",
  "schemaKind": "resolvedComponent",
  "schemaVersion": "1.0.0-beta",
  "system": {
    "primitives": {
      "atoms.color.brandPrimary": {
        "definition": {
          "kind": "hex",
          "value": "#FF5A5F"
        },
        "name": "atoms.color.brandPrimary",
        "tokenType": "Color"
      },
      "atoms.color.canvas": {
        "definition": {
          "kind": "hex",
          "value": "#F7F7F7"
        },
        "name": "atoms.color.canvas",
        "tokenType": "Color"
      },
      "atoms.color.elevated": {
        "definition": {
          "kind": "hex",
          "value": "#EBEBEB"
        },
        "name": "atoms.color.elevated",
        "tokenType": "Color"
      },
      "atoms.color.rgb": {
        "definition": {
          "kind": "hex",
          "value": "#D3D3D3"
        },
        "name": "atoms.color.rgb",
        "tokenType": "Color"
      },
      "atoms.color.rgba": {
        "definition": {
          "kind": "hex",
          "value": "#222222"
        },
        "name": "atoms.color.rgba",
        "tokenType": "Color"
      },
      "atoms.radius.md": {
        "definition": {
          "kind": "number",
          "value": 8
        },
        "name": "atoms.radius.md",
        "tokenType": "Radius"
      }
    },
    "semantics": {
      "atoms.color.sem.fromRgb": {
        "definition": "primitive:atoms.color.canvas",
        "name": "atoms.color.sem.fromRgb",
        "tokenType": "Color"
      },
      "atoms.color.sem.fromRgba": {
        "definition": "primitive:atoms.color.elevated",
        "name": "atoms.color.sem.fromRgba",
        "tokenType": "Color"
      }
    },
    "themes": {
      "AtomsCool": {
        "baseTheme": null,
        "overrides": {
          "atoms.color.sem.fromRgb": "primitive:atoms.color.rgb"
        }
      },
      "AtomsWarm": {
        "baseTheme": null,
        "overrides": {
          "atoms.color.sem.fromRgb": "primitive:atoms.color.brandPrimary"
        }
      }
    },
    "variantTypes": {
      "MoleculeMatrixKind": {
        "cases": [
          "primary",
          "secondary",
          "danger"
        ],
        "name": "MoleculeMatrixKind"
      },
      "MoleculeMatrixSize": {
        "cases": [
          "compact",
          "regular"
        ],
        "name": "MoleculeMatrixSize"
      }
    }
  }
}
